"Status","Start Time","Stop Time","Duration in ms","Parent Suite","Suite","Sub Suite","Test Class","Test Method","Name","Description"
"passed","Fri Dec 05 03:13:46 UTC 2025","Fri Dec 05 03:13:53 UTC 2025","6677","","ui.tests.FormTest","","ui.tests.FormTest","testCompleteFormSubmission","Should submit student registration form successfully [1]","Verify that student registration form can be filled and submitted with all fields"
"passed","Fri Dec 05 03:13:27 UTC 2025","Fri Dec 05 03:13:35 UTC 2025","8834","","ui.tests.FormTest","","ui.tests.FormTest","testSubjectAutocomplete","Should handle subject selection with autocomplete [1]","Verify that subjects can be selected using autocomplete dropdown"
"passed","Fri Dec 05 03:13:08 UTC 2025","Fri Dec 05 03:13:26 UTC 2025","18767","","ui.tests.FormTest","","ui.tests.FormTest","testDatePickerSelection","Should handle date picker selection [1]","Verify that date of birth can be selected from date picker"
"passed","Fri Dec 05 03:13:41 UTC 2025","Fri Dec 05 03:13:46 UTC 2025","5660","","ui.tests.FormTest","","ui.tests.FormTest","testStateAndCityDropdowns","Should handle state and city dropdown selection [1]","Verify that state and city can be selected from dependent dropdowns"
"passed","Fri Dec 05 03:13:35 UTC 2025","Fri Dec 05 03:13:41 UTC 2025","5250","","ui.tests.FormTest","","ui.tests.FormTest","testMinimalFormSubmission","Should submit form with required fields only [1]","Verify that form can be submitted with only required fields"
