"Status","Start Time","Stop Time","Duration in ms","Parent Suite","Suite","Sub Suite","Test Class","Test Method","Name","Description"
"passed","Sat Jan 03 03:16:18 UTC 2026","Sat Jan 03 03:16:32 UTC 2026","13867","","ui.tests.FormTest","","ui.tests.FormTest","testDatePickerSelection","Should handle date picker selection [1]","Verify that date of birth can be selected from date picker"
"passed","Sat Jan 03 03:16:40 UTC 2026","Sat Jan 03 03:16:45 UTC 2026","4760","","ui.tests.FormTest","","ui.tests.FormTest","testStateAndCityDropdowns","Should handle state and city dropdown selection [1]","Verify that state and city can be selected from dependent dropdowns"
"passed","Sat Jan 03 03:16:32 UTC 2026","Sat Jan 03 03:16:36 UTC 2026","4465","","ui.tests.FormTest","","ui.tests.FormTest","testSubjectAutocomplete","Should handle subject selection with autocomplete [1]","Verify that subjects can be selected using autocomplete dropdown"
"passed","Sat Jan 03 03:16:36 UTC 2026","Sat Jan 03 03:16:40 UTC 2026","3997","","ui.tests.FormTest","","ui.tests.FormTest","testMinimalFormSubmission","Should submit form with required fields only [1]","Verify that form can be submitted with only required fields"
"passed","Sat Jan 03 03:16:45 UTC 2026","Sat Jan 03 03:16:51 UTC 2026","5800","","ui.tests.FormTest","","ui.tests.FormTest","testCompleteFormSubmission","Should submit student registration form successfully [1]","Verify that student registration form can be filled and submitted with all fields"
